{
  "plugin": "c2-extension-development",
  "purpose": "Cobalt Strike Aggressor, BOF development, and C2 extension reference workflows.",
  "agents": [
    "exploit-dev"
  ],
  "skills": [
    "cobalt-strike-aggressor-development",
    "c2-bof-development",
    "beacon-object-file-development",
    "cobalt-strike-aggressor-reference"
  ]
}
