{
  "plugin": "timeline-evidence",
  "purpose": "Pentest timeline ingestion, consolidation, and evidence packaging workflows.",
  "agents": [
    "report-writer"
  ],
  "skills": [
    "timeline-asciinema",
    "timeline-cobaltstrike",
    "timeline-consolidator",
    "timeline-ghostwriter",
    "timeline-markdown-notes",
    "timeline-mythic",
    "timeline-pdf-notes",
    "timeline-workflow"
  ]
}
